{
 "schema": "stale-feed/v1",
 "schema_url": "https://stalefp.github.io/feed/schema-v1.json",
 "docs_url": "https://stalefp.github.io/feed/",
 "sample": true,
 "generated_at": "2026-10-02T05:50:13Z",
 "reference_platform": "linux",
 "variant_definitions": {
  "default": {
   "label": "Default (with ca34)",
   "flags": [],
   "population_share": null,
   "population_platforms": null,
   "population_study": null
  },
  "no_ca34": {
   "label": "Without ca34",
   "flags": [
    "--disable-features=TLSTrustAnchorIDs"
   ],
   "population_share": null,
   "population_platforms": null,
   "population_study": null
  },
  "pq": {
   "label": "Post-quantum experiment (0x12e0)",
   "flags": [
    "--enable-features=AddTLSServerHandshakePadding:AddTLSServerHandshakePaddingBytes/9000"
   ],
   "population_share": 0.06,
   "population_platforms": [
    "linux"
   ],
   "population_study": "PqcBandwidthExperiment"
  }
 },
 "platforms": {
  "linux": {
   "status": "captured",
   "platform": "linux",
   "browser": "Google Chrome",
   "channel": "stable",
   "version": "154.0.8037.97",
   "os": "Linux x86_64 (Ubuntu 24.04.5 LTS, kernel 6.17.0-1022-azure)",
   "captured_at": "2026-10-02T05:38:28Z",
   "captured_date": "2026-10-02",
   "capture_run": "https://github.com/stalefp/stalefp.github.io/actions/runs/36969798429",
   "stable_newest": "154.0.8037.97",
   "stable_full_rollout": "154.0.8037.97",
   "variants": {
    "default": {
     "config": "default-headed",
     "ja4": "t13d1517h2_8daaf6152771_cb7bf5808d99",
     "ja4_resumed": "t13d1518h2_8daaf6152771_e2d80978ab2e",
     "ja4_r": "t13d1517h2_002f,0035,009c,009d,1301,1302,1303,c013,c014,c02b,c02c,c02f,c030,cca8,cca9_0005,000a,000b,000d,0012,0017,001b,0023,002b,002d,0033,44cd,ca34,fe0d,ff01_0904,0905,0906,0403,0804,0401,0503,0805,0501,0806,0601",
     "quic_ja4": "q13d0312h3_55b375c5d22e_178839b6cec1",
     "quic_ja4_resumed": "q13d0314h3_55b375c5d22e_79cc91d6b50c",
     "h2_akamai": "1:65536;2:0;4:6291456;6:262144|15663105|0|m,a,s,p",
     "h3_settings": {
      "1": 65536,
      "6": 262144,
      "7": 100,
      "51": 1
     },
     "has_trust_anchors": true
    },
    "no_ca34": {
     "config": "disable-TLSTrustAnchorIDs-headed",
     "ja4": "t13d1516h2_8daaf6152771_806a8c22fdea",
     "ja4_resumed": "t13d1517h2_8daaf6152771_a87ad97598a9",
     "ja4_r": "t13d1516h2_002f,0035,009c,009d,1301,1302,1303,c013,c014,c02b,c02c,c02f,c030,cca8,cca9_0005,000a,000b,000d,0012,0017,001b,0023,002b,002d,0033,44cd,fe0d,ff01_0904,0905,0906,0403,0804,0401,0503,0805,0501,0806,0601",
     "quic_ja4": "q13d0311h3_55b375c5d22e_653d80c3fe9d",
     "quic_ja4_resumed": "q13d0313h3_55b375c5d22e_226f3f127bbe",
     "h2_akamai": "1:65536;2:0;4:6291456;6:262144|15663105|0|m,a,s,p",
     "h3_settings": {
      "1": 65536,
      "6": 262144,
      "7": 100,
      "51": 1
     },
     "has_trust_anchors": false
    },
    "pq": {
     "config": "finch-AddTLSServerHandshakePadding-headed",
     "ja4": "t13d1518h2_8daaf6152771_4980c97edce0",
     "ja4_resumed": "t13d1519h2_8daaf6152771_3d1b1b7bef36",
     "ja4_r": "t13d1518h2_002f,0035,009c,009d,1301,1302,1303,c013,c014,c02b,c02c,c02f,c030,cca8,cca9_0005,000a,000b,000d,0012,0017,001b,0023,002b,002d,0033,12e0,44cd,ca34,fe0d,ff01_0904,0905,0906,0403,0804,0401,0503,0805,0501,0806,0601",
     "quic_ja4": "q13d0313h3_55b375c5d22e_eb028bd37c08",
     "quic_ja4_resumed": "q13d0315h3_55b375c5d22e_7a6cb47ef016",
     "h2_akamai": "1:65536;2:0;4:6291456;6:262144|15663105|0|m,a,s,p",
     "h3_settings": {
      "1": 65536,
      "6": 262144,
      "7": 100,
      "51": 1
     },
     "has_trust_anchors": true
    }
   }
  },
  "windows": {
   "status": "captured",
   "platform": "windows",
   "browser": "Google Chrome",
   "channel": "stable",
   "version": "154.0.8037.98",
   "os": "Windows 2025Server (AMD64, build 10.0.26100)",
   "captured_at": "2026-10-02T05:39:26Z",
   "captured_date": "2026-10-02",
   "capture_run": "https://github.com/stalefp/stalefp.github.io/actions/runs/36969798429",
   "stable_newest": "155.0.8059.26",
   "stable_full_rollout": "154.0.8037.98",
   "variants": {
    "default": {
     "config": "default-headed",
     "ja4": "t13d1517h2_8daaf6152771_cb7bf5808d99",
     "ja4_resumed": "t13d1518h2_8daaf6152771_e2d80978ab2e",
     "ja4_r": "t13d1517h2_002f,0035,009c,009d,1301,1302,1303,c013,c014,c02b,c02c,c02f,c030,cca8,cca9_0005,000a,000b,000d,0012,0017,001b,0023,002b,002d,0033,44cd,ca34,fe0d,ff01_0904,0905,0906,0403,0804,0401,0503,0805,0501,0806,0601",
     "quic_ja4": "q13d0312h3_55b375c5d22e_178839b6cec1",
     "quic_ja4_resumed": "q13d0314h3_55b375c5d22e_79cc91d6b50c",
     "h2_akamai": "1:65536;2:0;4:6291456;6:262144|15663105|0|m,a,s,p",
     "h3_settings": {
      "1": 65536,
      "6": 262144,
      "7": 100,
      "51": 1
     },
     "has_trust_anchors": true
    },
    "no_ca34": {
     "config": "disable-TLSTrustAnchorIDs-headed",
     "ja4": "t13d1516h2_8daaf6152771_806a8c22fdea",
     "ja4_resumed": "t13d1517h2_8daaf6152771_a87ad97598a9",
     "ja4_r": "t13d1516h2_002f,0035,009c,009d,1301,1302,1303,c013,c014,c02b,c02c,c02f,c030,cca8,cca9_0005,000a,000b,000d,0012,0017,001b,0023,002b,002d,0033,44cd,fe0d,ff01_0904,0905,0906,0403,0804,0401,0503,0805,0501,0806,0601",
     "quic_ja4": "q13d0311h3_55b375c5d22e_653d80c3fe9d",
     "quic_ja4_resumed": "q13d0313h3_55b375c5d22e_226f3f127bbe",
     "h2_akamai": "1:65536;2:0;4:6291456;6:262144|15663105|0|m,a,s,p",
     "h3_settings": {
      "1": 65536,
      "6": 262144,
      "7": 100,
      "51": 1
     },
     "has_trust_anchors": false
    },
    "pq": {
     "config": "finch-AddTLSServerHandshakePadding-headed",
     "ja4": "t13d1518h2_8daaf6152771_4980c97edce0",
     "ja4_resumed": "t13d1519h2_8daaf6152771_3d1b1b7bef36",
     "ja4_r": "t13d1518h2_002f,0035,009c,009d,1301,1302,1303,c013,c014,c02b,c02c,c02f,c030,cca8,cca9_0005,000a,000b,000d,0012,0017,001b,0023,002b,002d,0033,12e0,44cd,ca34,fe0d,ff01_0904,0905,0906,0403,0804,0401,0503,0805,0501,0806,0601",
     "quic_ja4": "q13d0313h3_55b375c5d22e_eb028bd37c08",
     "quic_ja4_resumed": "q13d0315h3_55b375c5d22e_7a6cb47ef016",
     "h2_akamai": "1:65536;2:0;4:6291456;6:262144|15663105|0|m,a,s,p",
     "h3_settings": {
      "1": 65536,
      "6": 262144,
      "7": 100,
      "51": 1
     },
     "has_trust_anchors": true
    }
   }
  },
  "macos": {
   "status": "captured",
   "platform": "macos",
   "browser": "Google Chrome",
   "channel": "stable",
   "version": "154.0.8037.98",
   "os": "macOS 26.6.2 (arm64, Darwin 25.6.0)",
   "captured_at": "2026-10-02T05:39:03Z",
   "captured_date": "2026-10-02",
   "capture_run": "https://github.com/stalefp/stalefp.github.io/actions/runs/36969798429",
   "stable_newest": "155.0.8059.26",
   "stable_full_rollout": "154.0.8037.98",
   "variants": {
    "default": {
     "config": "default-headed",
     "ja4": "t13d1517h2_8daaf6152771_cb7bf5808d99",
     "ja4_resumed": "t13d1518h2_8daaf6152771_e2d80978ab2e",
     "ja4_r": "t13d1517h2_002f,0035,009c,009d,1301,1302,1303,c013,c014,c02b,c02c,c02f,c030,cca8,cca9_0005,000a,000b,000d,0012,0017,001b,0023,002b,002d,0033,44cd,ca34,fe0d,ff01_0904,0905,0906,0403,0804,0401,0503,0805,0501,0806,0601",
     "quic_ja4": "q13d0312h3_55b375c5d22e_178839b6cec1",
     "quic_ja4_resumed": "q13d0314h3_55b375c5d22e_79cc91d6b50c",
     "h2_akamai": "1:65536;2:0;4:6291456;6:262144|15663105|0|m,a,s,p",
     "h3_settings": {
      "1": 65536,
      "6": 262144,
      "7": 100,
      "51": 1
     },
     "has_trust_anchors": true
    },
    "no_ca34": {
     "config": "disable-TLSTrustAnchorIDs-headed",
     "ja4": "t13d1516h2_8daaf6152771_806a8c22fdea",
     "ja4_resumed": "t13d1517h2_8daaf6152771_a87ad97598a9",
     "ja4_r": "t13d1516h2_002f,0035,009c,009d,1301,1302,1303,c013,c014,c02b,c02c,c02f,c030,cca8,cca9_0005,000a,000b,000d,0012,0017,001b,0023,002b,002d,0033,44cd,fe0d,ff01_0904,0905,0906,0403,0804,0401,0503,0805,0501,0806,0601",
     "quic_ja4": "q13d0311h3_55b375c5d22e_653d80c3fe9d",
     "quic_ja4_resumed": "q13d0313h3_55b375c5d22e_226f3f127bbe",
     "h2_akamai": "1:65536;2:0;4:6291456;6:262144|15663105|0|m,a,s,p",
     "h3_settings": {
      "1": 65536,
      "6": 262144,
      "7": 100,
      "51": 1
     },
     "has_trust_anchors": false
    },
    "pq": {
     "config": "finch-AddTLSServerHandshakePadding-headed",
     "ja4": "t13d1518h2_8daaf6152771_4980c97edce0",
     "ja4_resumed": "t13d1519h2_8daaf6152771_3d1b1b7bef36",
     "ja4_r": "t13d1518h2_002f,0035,009c,009d,1301,1302,1303,c013,c014,c02b,c02c,c02f,c030,cca8,cca9_0005,000a,000b,000d,0012,0017,001b,0023,002b,002d,0033,12e0,44cd,ca34,fe0d,ff01_0904,0905,0906,0403,0804,0401,0503,0805,0501,0806,0601",
     "quic_ja4": "q13d0313h3_55b375c5d22e_eb028bd37c08",
     "quic_ja4_resumed": "q13d0315h3_55b375c5d22e_7a6cb47ef016",
     "h2_akamai": "1:65536;2:0;4:6291456;6:262144|15663105|0|m,a,s,p",
     "h3_settings": {
      "1": 65536,
      "6": 262144,
      "7": 100,
      "51": 1
     },
     "has_trust_anchors": true
    }
   }
  }
 },
 "changes": [
  {
   "platform": "linux",
   "date": "2026-10-02",
   "previous": {
    "version": "154.0.8037.97",
    "captured_at": "2026-10-02T03:20:28Z"
   },
   "current": {
    "version": "154.0.8037.97",
    "captured_at": "2026-10-02T05:38:28Z"
   },
   "fields": []
  },
  {
   "platform": "linux",
   "date": "2026-10-02",
   "previous": {
    "version": "154.0.8037.57",
    "captured_at": "2026-09-27T06:59:50Z"
   },
   "current": {
    "version": "154.0.8037.97",
    "captured_at": "2026-10-02T03:20:28Z"
   },
   "fields": [
    {
     "field": "chrome_version",
     "variant": null,
     "label": "Chrome version",
     "before": "154.0.8037.57",
     "after": "154.0.8037.97"
    }
   ]
  }
 ],
 "history": [
  {
   "platform": "linux",
   "version": "154.0.8037.97",
   "captured_at": "2026-10-02T05:38:28Z",
   "captured_date": "2026-10-02",
   "variants": {
    "default": {
     "ja4": "t13d1517h2_8daaf6152771_cb7bf5808d99",